Starting quiz validation tests...

Progress: 1/200 tests | Correct: 1 | Incorrect: 0 | Current: Test #1Progress: 2/200 tests | Correct: 2 | Incorrect: 0 | Current: Test #2Progress: 3/200 tests | Correct: 3 | Incorrect: 0 | Current: Test #3Progress: 4/200 tests | Correct: 4 | Incorrect: 0 | Current: Test #4Progress: 5/200 tests | Correct: 5 | Incorrect: 0 | Current: Test #5Progress: 6/200 tests | Correct: 6 | Incorrect: 0 | Current: Test #6Progress: 7/200 tests | Correct: 7 | Incorrect: 0 | Current: Test #7Progress: 8/200 tests | Correct: 8 | Incorrect: 0 | Current: Test #8Progress: 9/200 tests | Correct: 9 | Incorrect: 0 | Current: Test #9Progress: 10/200 tests | Correct: 10 | Incorrect: 0 | Current: Test #10
Progress: 10/200 tests | Correct: 10 | Incorrect: 0 | Current: Test #10
Progress: 11/200 tests | Correct: 11 | Incorrect: 0 | Current: Test #11Progress: 12/200 tests | Correct: 12 | Incorrect: 0 | Current: Test #12Progress: 13/200 tests | Correct: 13 | Incorrect: 0 | Current: Test #13Progress: 14/200 tests | Correct: 14 | Incorrect: 0 | Current: Test #14Progress: 15/200 tests | Correct: 15 | Incorrect: 0 | Current: Test #15Progress: 16/200 tests | Correct: 16 | Incorrect: 0 | Current: Test #16Progress: 17/200 tests | Correct: 17 | Incorrect: 0 | Current: Test #17Progress: 18/200 tests | Correct: 18 | Incorrect: 0 | Current: Test #18Progress: 19/200 tests | Correct: 19 | Incorrect: 0 | Current: Test #19
❌ INCORRECT RESULT - Test #20
   Expected Primary: sovereign
   Actual Primary: acolyte
   Top 3 Expected Scores: dominance: 81, voyeur: 81, switch: 81
Progress: 20/200 tests | Correct: 19 | Incorrect: 1 | Current: Test #20
Progress: 20/200 tests | Correct: 19 | Incorrect: 1 | Current: Test #20
Progress: 21/200 tests | Correct: 20 | Incorrect: 1 | Current: Test #21Progress: 22/200 tests | Correct: 21 | Incorrect: 1 | Current: Test #22Progress: 23/200 tests | Correct: 22 | Incorrect: 1 | Current: Test #23Progress: 24/200 tests | Correct: 23 | Incorrect: 1 | Current: Test #24Progress: 25/200 tests | Correct: 24 | Incorrect: 1 | Current: Test #25Progress: 26/200 tests | Correct: 25 | Incorrect: 1 | Current: Test #26Progress: 27/200 tests | Correct: 26 | Incorrect: 1 | Current: Test #27Progress: 28/200 tests | Correct: 27 | Incorrect: 1 | Current: Test #28Progress: 29/200 tests | Correct: 28 | Incorrect: 1 | Current: Test #29Progress: 30/200 tests | Correct: 29 | Incorrect: 1 | Current: Test #30
Progress: 30/200 tests | Correct: 29 | Incorrect: 1 | Current: Test #30
Progress: 31/200 tests | Correct: 30 | Incorrect: 1 | Current: Test #31Progress: 32/200 tests | Correct: 31 | Incorrect: 1 | Current: Test #32Progress: 33/200 tests | Correct: 32 | Incorrect: 1 | Current: Test #33Progress: 34/200 tests | Correct: 33 | Incorrect: 1 | Current: Test #34Progress: 35/200 tests | Correct: 34 | Incorrect: 1 | Current: Test #35Progress: 36/200 tests | Correct: 35 | Incorrect: 1 | Current: Test #36Progress: 37/200 tests | Correct: 36 | Incorrect: 1 | Current: Test #37Progress: 38/200 tests | Correct: 37 | Incorrect: 1 | Current: Test #38Progress: 39/200 tests | Correct: 38 | Incorrect: 1 | Current: Test #39Progress: 40/200 tests | Correct: 39 | Incorrect: 1 | Current: Test #40
Progress: 40/200 tests | Correct: 39 | Incorrect: 1 | Current: Test #40

❌ INCORRECT RESULT - Test #41
   Expected Primary: apex
   Actual Primary: acolyte
   Top 3 Expected Scores: primal_hunter: 84, dominance: 80, sadism: 77
Progress: 41/200 tests | Correct: 39 | Incorrect: 2 | Current: Test #41Progress: 42/200 tests | Correct: 40 | Incorrect: 2 | Current: Test #42Progress: 43/200 tests | Correct: 41 | Incorrect: 2 | Current: Test #43Progress: 44/200 tests | Correct: 42 | Incorrect: 2 | Current: Test #44Progress: 45/200 tests | Correct: 43 | Incorrect: 2 | Current: Test #45Progress: 46/200 tests | Correct: 44 | Incorrect: 2 | Current: Test #46Progress: 47/200 tests | Correct: 45 | Incorrect: 2 | Current: Test #47Progress: 48/200 tests | Correct: 46 | Incorrect: 2 | Current: Test #48
❌ INCORRECT RESULT - Test #49
   Expected Primary: protector
   Actual Primary: acolyte
   Top 3 Expected Scores: caregiver: 87, masochism: 76, service: 75
Progress: 49/200 tests | Correct: 46 | Incorrect: 3 | Current: Test #49Progress: 50/200 tests | Correct: 47 | Incorrect: 3 | Current: Test #50
Progress: 50/200 tests | Correct: 47 | Incorrect: 3 | Current: Test #50
Progress: 51/200 tests | Correct: 48 | Incorrect: 3 | Current: Test #51Progress: 52/200 tests | Correct: 49 | Incorrect: 3 | Current: Test #52Progress: 53/200 tests | Correct: 50 | Incorrect: 3 | Current: Test #53Progress: 54/200 tests | Correct: 51 | Incorrect: 3 | Current: Test #54Progress: 55/200 tests | Correct: 52 | Incorrect: 3 | Current: Test #55Progress: 56/200 tests | Correct: 53 | Incorrect: 3 | Current: Test #56Progress: 57/200 tests | Correct: 54 | Incorrect: 3 | Current: Test #57Progress: 58/200 tests | Correct: 55 | Incorrect: 3 | Current: Test #58Progress: 59/200 tests | Correct: 56 | Incorrect: 3 | Current: Test #59Progress: 60/200 tests | Correct: 57 | Incorrect: 3 | Current: Test #60
Progress: 60/200 tests | Correct: 57 | Incorrect: 3 | Current: Test #60
Progress: 61/200 tests | Correct: 58 | Incorrect: 3 | Current: Test #61Progress: 62/200 tests | Correct: 59 | Incorrect: 3 | Current: Test #62Progress: 63/200 tests | Correct: 60 | Incorrect: 3 | Current: Test #63Progress: 64/200 tests | Correct: 61 | Incorrect: 3 | Current: Test #64Progress: 65/200 tests | Correct: 62 | Incorrect: 3 | Current: Test #65Progress: 66/200 tests | Correct: 63 | Incorrect: 3 | Current: Test #66Progress: 67/200 tests | Correct: 64 | Incorrect: 3 | Current: Test #67Progress: 68/200 tests | Correct: 65 | Incorrect: 3 | Current: Test #68Progress: 69/200 tests | Correct: 66 | Incorrect: 3 | Current: Test #69Progress: 70/200 tests | Correct: 67 | Incorrect: 3 | Current: Test #70
Progress: 70/200 tests | Correct: 67 | Incorrect: 3 | Current: Test #70
Progress: 71/200 tests | Correct: 68 | Incorrect: 3 | Current: Test #71Progress: 72/200 tests | Correct: 69 | Incorrect: 3 | Current: Test #72Progress: 73/200 tests | Correct: 70 | Incorrect: 3 | Current: Test #73Progress: 74/200 tests | Correct: 71 | Incorrect: 3 | Current: Test #74
❌ INCORRECT RESULT - Test #75
   Expected Primary: weaver
   Actual Primary: acolyte
   Top 3 Expected Scores: rigger: 70, exhibitionist: 70, masochism: 69
Progress: 75/200 tests | Correct: 71 | Incorrect: 4 | Current: Test #75
❌ INCORRECT RESULT - Test #76
   Expected Primary: beloved
   Actual Primary: acolyte
   Top 3 Expected Scores: property: 85, rigger: 84, service: 75
Progress: 76/200 tests | Correct: 71 | Incorrect: 5 | Current: Test #76
❌ INCORRECT RESULT - Test #77
   Expected Primary: acolyte
   Actual Primary: null
   Top 3 Expected Scores: service: 100, owner: 90, exhibitionist: 75
Progress: 77/200 tests | Correct: 71 | Incorrect: 6 | Current: Test #77Progress: 78/200 tests | Correct: 72 | Incorrect: 6 | Current: Test #78Progress: 79/200 tests | Correct: 73 | Incorrect: 6 | Current: Test #79Progress: 80/200 tests | Correct: 74 | Incorrect: 6 | Current: Test #80
Progress: 80/200 tests | Correct: 74 | Incorrect: 6 | Current: Test #80
Progress: 81/200 tests | Correct: 75 | Incorrect: 6 | Current: Test #81Progress: 82/200 tests | Correct: 76 | Incorrect: 6 | Current: Test #82Progress: 83/200 tests | Correct: 77 | Incorrect: 6 | Current: Test #83Progress: 84/200 tests | Correct: 78 | Incorrect: 6 | Current: Test #84Progress: 85/200 tests | Correct: 79 | Incorrect: 6 | Current: Test #85Progress: 86/200 tests | Correct: 80 | Incorrect: 6 | Current: Test #86
❌ INCORRECT RESULT - Test #87
   Expected Primary: phoenix
   Actual Primary: acolyte
   Top 3 Expected Scores: masochism: 75, switch: 75, dependent: 68
Progress: 87/200 tests | Correct: 80 | Incorrect: 7 | Current: Test #87
❌ INCORRECT RESULT - Test #88
   Expected Primary: apex
   Actual Primary: acolyte
   Top 3 Expected Scores: primal_hunter: 95, service: 88, sadism: 84
Progress: 88/200 tests | Correct: 80 | Incorrect: 8 | Current: Test #88Progress: 89/200 tests | Correct: 81 | Incorrect: 8 | Current: Test #89Progress: 90/200 tests | Correct: 82 | Incorrect: 8 | Current: Test #90
Progress: 90/200 tests | Correct: 82 | Incorrect: 8 | Current: Test #90
Progress: 91/200 tests | Correct: 83 | Incorrect: 8 | Current: Test #91Progress: 92/200 tests | Correct: 84 | Incorrect: 8 | Current: Test #92Progress: 93/200 tests | Correct: 85 | Incorrect: 8 | Current: Test #93Progress: 94/200 tests | Correct: 86 | Incorrect: 8 | Current: Test #94Test 95 error: net::ERR_CONNECTION_REFUSED at http://localhost:3000?testMode=true
Test 95 failed: net::ERR_CONNECTION_REFUSED at http://localhost:3000?testMode=true
Test 96 error: net::ERR_CONNECTION_REFUSED at http://localhost:3000?testMode=true
Test 96 failed: net::ERR_CONNECTION_REFUSED at http://localhost:3000?testMode=true
Test 97 error: net::ERR_CONNECTION_REFUSED at http://localhost:3000?testMode=true
Test 97 failed: net::ERR_CONNECTION_REFUSED at http://localhost:3000?testMode=true
Test 98 error: net::ERR_CONNECTION_REFUSED at http://localhost:3000?testMode=true
Test 98 failed: net::ERR_CONNECTION_REFUSED at http://localhost:3000?testMode=true
Test 99 error: net::ERR_CONNECTION_REFUSED at http://localhost:3000?testMode=true
Test 99 failed: net::ERR_CONNECTION_REFUSED at http://localhost:3000?testMode=true
Test 100 error: net::ERR_CONNECTION_REFUSED at http://localhost:3000?testMode=true
Test 100 failed: net::ERR_CONNECTION_REFUSED at http://localhost:3000?testMode=true
Test 101 error: net::ERR_CONNECTION_REFUSED at http://localhost:3000?testMode=true
Test 101 failed: net::ERR_CONNECTION_REFUSED at http://localhost:3000?testMode=true
Test 102 error: net::ERR_CONNECTION_REFUSED at http://localhost:3000?testMode=true
Test 102 failed: net::ERR_CONNECTION_REFUSED at http://localhost:3000?testMode=true
Test 103 error: net::ERR_CONNECTION_REFUSED at http://localhost:3000?testMode=true
Test 103 failed: net::ERR_CONNECTION_REFUSED at http://localhost:3000?testMode=true
Test 104 error: net::ERR_CONNECTION_REFUSED at http://localhost:3000?testMode=true
Test 104 failed: net::ERR_CONNECTION_REFUSED at http://localhost:3000?testMode=true
Test 105 error: net::ERR_CONNECTION_REFUSED at http://localhost:3000?testMode=true
Test 105 failed: net::ERR_CONNECTION_REFUSED at http://localhost:3000?testMode=true
Test 106 error: net::ERR_CONNECTION_REFUSED at http://localhost:3000?testMode=true
Test 106 failed: net::ERR_CONNECTION_REFUSED at http://localhost:3000?testMode=true
Test 107 error: net::ERR_CONNECTION_REFUSED at http://localhost:3000?testMode=true
Test 107 failed: net::ERR_CONNECTION_REFUSED at http://localhost:3000?testMode=true
Test 108 error: net::ERR_CONNECTION_REFUSED at http://localhost:3000?testMode=true
Test 108 failed: net::ERR_CONNECTION_REFUSED at http://localhost:3000?testMode=true
Test 109 error: net::ERR_CONNECTION_REFUSED at http://localhost:3000?testMode=true
Test 109 failed: net::ERR_CONNECTION_REFUSED at http://localhost:3000?testMode=true
Test 110 error: net::ERR_CONNECTION_REFUSED at http://localhost:3000?testMode=true
Test 110 failed: net::ERR_CONNECTION_REFUSED at http://localhost:3000?testMode=true
Test 111 error: net::ERR_CONNECTION_REFUSED at http://localhost:3000?testMode=true
Test 111 failed: net::ERR_CONNECTION_REFUSED at http://localhost:3000?testMode=true
Test 112 error: net::ERR_CONNECTION_REFUSED at http://localhost:3000?testMode=true
Test 112 failed: net::ERR_CONNECTION_REFUSED at http://localhost:3000?testMode=true
Test 113 error: net::ERR_CONNECTION_REFUSED at http://localhost:3000?testMode=true
Test 113 failed: net::ERR_CONNECTION_REFUSED at http://localhost:3000?testMode=true
Test 114 error: net::ERR_CONNECTION_REFUSED at http://localhost:3000?testMode=true
Test 114 failed: net::ERR_CONNECTION_REFUSED at http://localhost:3000?testMode=true
Test 115 error: net::ERR_CONNECTION_REFUSED at http://localhost:3000?testMode=true
Test 115 failed: net::ERR_CONNECTION_REFUSED at http://localhost:3000?testMode=true
Test 116 error: net::ERR_CONNECTION_REFUSED at http://localhost:3000?testMode=true
Test 116 failed: net::ERR_CONNECTION_REFUSED at http://localhost:3000?testMode=true
Test 117 error: net::ERR_CONNECTION_REFUSED at http://localhost:3000?testMode=true
Test 117 failed: net::ERR_CONNECTION_REFUSED at http://localhost:3000?testMode=true
Test 118 error: net::ERR_CONNECTION_REFUSED at http://localhost:3000?testMode=true
Test 118 failed: net::ERR_CONNECTION_REFUSED at http://localhost:3000?testMode=true
Test 119 error: net::ERR_CONNECTION_REFUSED at http://localhost:3000?testMode=true
Test 119 failed: net::ERR_CONNECTION_REFUSED at http://localhost:3000?testMode=true
Test 120 error: net::ERR_CONNECTION_REFUSED at http://localhost:3000?testMode=true
Test 120 failed: net::ERR_CONNECTION_REFUSED at http://localhost:3000?testMode=true
Test 121 error: net::ERR_CONNECTION_REFUSED at http://localhost:3000?testMode=true
Test 121 failed: net::ERR_CONNECTION_REFUSED at http://localhost:3000?testMode=true
Test 122 error: net::ERR_CONNECTION_REFUSED at http://localhost:3000?testMode=true
Test 122 failed: net::ERR_CONNECTION_REFUSED at http://localhost:3000?testMode=true
Test 123 error: net::ERR_CONNECTION_REFUSED at http://localhost:3000?testMode=true
Test 123 failed: net::ERR_CONNECTION_REFUSED at http://localhost:3000?testMode=true
Test 124 error: net::ERR_CONNECTION_REFUSED at http://localhost:3000?testMode=true
Test 124 failed: net::ERR_CONNECTION_REFUSED at http://localhost:3000?testMode=true
Test 125 error: net::ERR_CONNECTION_REFUSED at http://localhost:3000?testMode=true
Test 125 failed: net::ERR_CONNECTION_REFUSED at http://localhost:3000?testMode=true
Test 126 error: net::ERR_CONNECTION_REFUSED at http://localhost:3000?testMode=true
Test 126 failed: net::ERR_CONNECTION_REFUSED at http://localhost:3000?testMode=true
Test 127 error: net::ERR_CONNECTION_REFUSED at http://localhost:3000?testMode=true
Test 127 failed: net::ERR_CONNECTION_REFUSED at http://localhost:3000?testMode=true
Test 128 error: net::ERR_CONNECTION_REFUSED at http://localhost:3000?testMode=true
Test 128 failed: net::ERR_CONNECTION_REFUSED at http://localhost:3000?testMode=true
Test 129 error: net::ERR_CONNECTION_REFUSED at http://localhost:3000?testMode=true
Test 129 failed: net::ERR_CONNECTION_REFUSED at http://localhost:3000?testMode=true
Test 130 error: net::ERR_CONNECTION_REFUSED at http://localhost:3000?testMode=true
Test 130 failed: net::ERR_CONNECTION_REFUSED at http://localhost:3000?testMode=true
Test 131 error: net::ERR_CONNECTION_REFUSED at http://localhost:3000?testMode=true
Test 131 failed: net::ERR_CONNECTION_REFUSED at http://localhost:3000?testMode=true
Test 132 error: net::ERR_CONNECTION_REFUSED at http://localhost:3000?testMode=true
Test 132 failed: net::ERR_CONNECTION_REFUSED at http://localhost:3000?testMode=true
Test 133 error: net::ERR_CONNECTION_REFUSED at http://localhost:3000?testMode=true
Test 133 failed: net::ERR_CONNECTION_REFUSED at http://localhost:3000?testMode=true
Test 134 error: net::ERR_CONNECTION_REFUSED at http://localhost:3000?testMode=true
Test 134 failed: net::ERR_CONNECTION_REFUSED at http://localhost:3000?testMode=true
Test 135 error: net::ERR_CONNECTION_REFUSED at http://localhost:3000?testMode=true
Test 135 failed: net::ERR_CONNECTION_REFUSED at http://localhost:3000?testMode=true
Test 136 error: net::ERR_CONNECTION_REFUSED at http://localhost:3000?testMode=true
Test 136 failed: net::ERR_CONNECTION_REFUSED at http://localhost:3000?testMode=true
Test 137 error: net::ERR_CONNECTION_REFUSED at http://localhost:3000?testMode=true
Test 137 failed: net::ERR_CONNECTION_REFUSED at http://localhost:3000?testMode=true
Test 138 error: net::ERR_CONNECTION_REFUSED at http://localhost:3000?testMode=true
Test 138 failed: net::ERR_CONNECTION_REFUSED at http://localhost:3000?testMode=true
Test 139 error: net::ERR_CONNECTION_REFUSED at http://localhost:3000?testMode=true
Test 139 failed: net::ERR_CONNECTION_REFUSED at http://localhost:3000?testMode=true
Test 140 error: net::ERR_CONNECTION_REFUSED at http://localhost:3000?testMode=true
Test 140 failed: net::ERR_CONNECTION_REFUSED at http://localhost:3000?testMode=true
Test 141 error: net::ERR_CONNECTION_REFUSED at http://localhost:3000?testMode=true
Test 141 failed: net::ERR_CONNECTION_REFUSED at http://localhost:3000?testMode=true
Test 142 error: net::ERR_CONNECTION_REFUSED at http://localhost:3000?testMode=true
Test 142 failed: net::ERR_CONNECTION_REFUSED at http://localhost:3000?testMode=true
Test 143 error: net::ERR_CONNECTION_REFUSED at http://localhost:3000?testMode=true
Test 143 failed: net::ERR_CONNECTION_REFUSED at http://localhost:3000?testMode=true
Test 144 error: net::ERR_CONNECTION_REFUSED at http://localhost:3000?testMode=true
Test 144 failed: net::ERR_CONNECTION_REFUSED at http://localhost:3000?testMode=true
Test 145 error: net::ERR_CONNECTION_REFUSED at http://localhost:3000?testMode=true
Test 145 failed: net::ERR_CONNECTION_REFUSED at http://localhost:3000?testMode=true
Test 146 error: net::ERR_CONNECTION_REFUSED at http://localhost:3000?testMode=true
Test 146 failed: net::ERR_CONNECTION_REFUSED at http://localhost:3000?testMode=true
Test 147 error: net::ERR_CONNECTION_REFUSED at http://localhost:3000?testMode=true
Test 147 failed: net::ERR_CONNECTION_REFUSED at http://localhost:3000?testMode=true
Test 148 error: net::ERR_CONNECTION_REFUSED at http://localhost:3000?testMode=true
Test 148 failed: net::ERR_CONNECTION_REFUSED at http://localhost:3000?testMode=true
Test 149 error: net::ERR_CONNECTION_REFUSED at http://localhost:3000?testMode=true
Test 149 failed: net::ERR_CONNECTION_REFUSED at http://localhost:3000?testMode=true
Test 150 error: net::ERR_CONNECTION_REFUSED at http://localhost:3000?testMode=true
Test 150 failed: net::ERR_CONNECTION_REFUSED at http://localhost:3000?testMode=true
Test 151 error: net::ERR_CONNECTION_REFUSED at http://localhost:3000?testMode=true
Test 151 failed: net::ERR_CONNECTION_REFUSED at http://localhost:3000?testMode=true
Test 152 error: net::ERR_CONNECTION_REFUSED at http://localhost:3000?testMode=true
Test 152 failed: net::ERR_CONNECTION_REFUSED at http://localhost:3000?testMode=true
Test 153 error: net::ERR_CONNECTION_REFUSED at http://localhost:3000?testMode=true
Test 153 failed: net::ERR_CONNECTION_REFUSED at http://localhost:3000?testMode=true
Test 154 error: net::ERR_CONNECTION_REFUSED at http://localhost:3000?testMode=true
Test 154 failed: net::ERR_CONNECTION_REFUSED at http://localhost:3000?testMode=true
Test 155 error: net::ERR_CONNECTION_REFUSED at http://localhost:3000?testMode=true
Test 155 failed: net::ERR_CONNECTION_REFUSED at http://localhost:3000?testMode=true
Test 156 error: net::ERR_CONNECTION_REFUSED at http://localhost:3000?testMode=true
Test 156 failed: net::ERR_CONNECTION_REFUSED at http://localhost:3000?testMode=true
Test 157 error: net::ERR_CONNECTION_REFUSED at http://localhost:3000?testMode=true
Test 157 failed: net::ERR_CONNECTION_REFUSED at http://localhost:3000?testMode=true
Test 158 error: net::ERR_CONNECTION_REFUSED at http://localhost:3000?testMode=true
Test 158 failed: net::ERR_CONNECTION_REFUSED at http://localhost:3000?testMode=true
Test 159 error: net::ERR_CONNECTION_REFUSED at http://localhost:3000?testMode=true
Test 159 failed: net::ERR_CONNECTION_REFUSED at http://localhost:3000?testMode=true
Test 160 error: net::ERR_CONNECTION_REFUSED at http://localhost:3000?testMode=true
Test 160 failed: net::ERR_CONNECTION_REFUSED at http://localhost:3000?testMode=true
Test 161 error: net::ERR_CONNECTION_REFUSED at http://localhost:3000?testMode=true
Test 161 failed: net::ERR_CONNECTION_REFUSED at http://localhost:3000?testMode=true
Test 162 error: net::ERR_CONNECTION_REFUSED at http://localhost:3000?testMode=true
Test 162 failed: net::ERR_CONNECTION_REFUSED at http://localhost:3000?testMode=true
Test 163 error: net::ERR_CONNECTION_REFUSED at http://localhost:3000?testMode=true
Test 163 failed: net::ERR_CONNECTION_REFUSED at http://localhost:3000?testMode=true
Test 164 error: net::ERR_CONNECTION_REFUSED at http://localhost:3000?testMode=true
Test 164 failed: net::ERR_CONNECTION_REFUSED at http://localhost:3000?testMode=true
Test 165 error: net::ERR_CONNECTION_REFUSED at http://localhost:3000?testMode=true
Test 165 failed: net::ERR_CONNECTION_REFUSED at http://localhost:3000?testMode=true
Test 166 error: net::ERR_CONNECTION_REFUSED at http://localhost:3000?testMode=true
Test 166 failed: net::ERR_CONNECTION_REFUSED at http://localhost:3000?testMode=true
Test 167 error: net::ERR_CONNECTION_REFUSED at http://localhost:3000?testMode=true
Test 167 failed: net::ERR_CONNECTION_REFUSED at http://localhost:3000?testMode=true
Test 168 error: net::ERR_CONNECTION_REFUSED at http://localhost:3000?testMode=true
Test 168 failed: net::ERR_CONNECTION_REFUSED at http://localhost:3000?testMode=true
Test 169 error: net::ERR_CONNECTION_REFUSED at http://localhost:3000?testMode=true
Test 169 failed: net::ERR_CONNECTION_REFUSED at http://localhost:3000?testMode=true
Test 170 error: net::ERR_CONNECTION_REFUSED at http://localhost:3000?testMode=true
Test 170 failed: net::ERR_CONNECTION_REFUSED at http://localhost:3000?testMode=true
Test 171 error: net::ERR_CONNECTION_REFUSED at http://localhost:3000?testMode=true
Test 171 failed: net::ERR_CONNECTION_REFUSED at http://localhost:3000?testMode=true
Test 172 error: net::ERR_CONNECTION_REFUSED at http://localhost:3000?testMode=true
Test 172 failed: net::ERR_CONNECTION_REFUSED at http://localhost:3000?testMode=true
Test 173 error: net::ERR_CONNECTION_REFUSED at http://localhost:3000?testMode=true
Test 173 failed: net::ERR_CONNECTION_REFUSED at http://localhost:3000?testMode=true
Test 174 error: net::ERR_CONNECTION_REFUSED at http://localhost:3000?testMode=true
Test 174 failed: net::ERR_CONNECTION_REFUSED at http://localhost:3000?testMode=true
Test 175 error: net::ERR_CONNECTION_REFUSED at http://localhost:3000?testMode=true
Test 175 failed: net::ERR_CONNECTION_REFUSED at http://localhost:3000?testMode=true
Test 176 error: net::ERR_CONNECTION_REFUSED at http://localhost:3000?testMode=true
Test 176 failed: net::ERR_CONNECTION_REFUSED at http://localhost:3000?testMode=true
Test 177 error: net::ERR_CONNECTION_REFUSED at http://localhost:3000?testMode=true
Test 177 failed: net::ERR_CONNECTION_REFUSED at http://localhost:3000?testMode=true
Test 178 error: net::ERR_CONNECTION_REFUSED at http://localhost:3000?testMode=true
Test 178 failed: net::ERR_CONNECTION_REFUSED at http://localhost:3000?testMode=true
Test 179 error: net::ERR_CONNECTION_REFUSED at http://localhost:3000?testMode=true
Test 179 failed: net::ERR_CONNECTION_REFUSED at http://localhost:3000?testMode=true
Test 180 error: net::ERR_CONNECTION_REFUSED at http://localhost:3000?testMode=true
Test 180 failed: net::ERR_CONNECTION_REFUSED at http://localhost:3000?testMode=true
Test 181 error: net::ERR_CONNECTION_REFUSED at http://localhost:3000?testMode=true
Test 181 failed: net::ERR_CONNECTION_REFUSED at http://localhost:3000?testMode=true
Test 182 error: net::ERR_CONNECTION_REFUSED at http://localhost:3000?testMode=true
Test 182 failed: net::ERR_CONNECTION_REFUSED at http://localhost:3000?testMode=true
Test 183 error: net::ERR_CONNECTION_REFUSED at http://localhost:3000?testMode=true
Test 183 failed: net::ERR_CONNECTION_REFUSED at http://localhost:3000?testMode=true
Test 184 error: net::ERR_CONNECTION_REFUSED at http://localhost:3000?testMode=true
Test 184 failed: net::ERR_CONNECTION_REFUSED at http://localhost:3000?testMode=true
Test 185 error: net::ERR_CONNECTION_REFUSED at http://localhost:3000?testMode=true
Test 185 failed: net::ERR_CONNECTION_REFUSED at http://localhost:3000?testMode=true
Test 186 error: net::ERR_CONNECTION_REFUSED at http://localhost:3000?testMode=true
Test 186 failed: net::ERR_CONNECTION_REFUSED at http://localhost:3000?testMode=true
Test 187 error: net::ERR_CONNECTION_REFUSED at http://localhost:3000?testMode=true
Test 187 failed: net::ERR_CONNECTION_REFUSED at http://localhost:3000?testMode=true
Test 188 error: net::ERR_CONNECTION_REFUSED at http://localhost:3000?testMode=true
Test 188 failed: net::ERR_CONNECTION_REFUSED at http://localhost:3000?testMode=true
Test 189 error: net::ERR_CONNECTION_REFUSED at http://localhost:3000?testMode=true
Test 189 failed: net::ERR_CONNECTION_REFUSED at http://localhost:3000?testMode=true
Test 190 error: net::ERR_CONNECTION_REFUSED at http://localhost:3000?testMode=true
Test 190 failed: net::ERR_CONNECTION_REFUSED at http://localhost:3000?testMode=true
Test 191 error: net::ERR_CONNECTION_REFUSED at http://localhost:3000?testMode=true
Test 191 failed: net::ERR_CONNECTION_REFUSED at http://localhost:3000?testMode=true
Test 192 error: net::ERR_CONNECTION_REFUSED at http://localhost:3000?testMode=true
Test 192 failed: net::ERR_CONNECTION_REFUSED at http://localhost:3000?testMode=true
Test 193 error: net::ERR_CONNECTION_REFUSED at http://localhost:3000?testMode=true
Test 193 failed: net::ERR_CONNECTION_REFUSED at http://localhost:3000?testMode=true
Test 194 error: net::ERR_CONNECTION_REFUSED at http://localhost:3000?testMode=true
Test 194 failed: net::ERR_CONNECTION_REFUSED at http://localhost:3000?testMode=true
Test 195 error: net::ERR_CONNECTION_REFUSED at http://localhost:3000?testMode=true
Test 195 failed: net::ERR_CONNECTION_REFUSED at http://localhost:3000?testMode=true
Test 196 error: net::ERR_CONNECTION_REFUSED at http://localhost:3000?testMode=true
Test 196 failed: net::ERR_CONNECTION_REFUSED at http://localhost:3000?testMode=true
Test 197 error: net::ERR_CONNECTION_REFUSED at http://localhost:3000?testMode=true
Test 197 failed: net::ERR_CONNECTION_REFUSED at http://localhost:3000?testMode=true
Test 198 error: net::ERR_CONNECTION_REFUSED at http://localhost:3000?testMode=true
Test 198 failed: net::ERR_CONNECTION_REFUSED at http://localhost:3000?testMode=true
Test 199 error: net::ERR_CONNECTION_REFUSED at http://localhost:3000?testMode=true
Test 199 failed: net::ERR_CONNECTION_REFUSED at http://localhost:3000?testMode=true
Test 200 error: net::ERR_CONNECTION_REFUSED at http://localhost:3000?testMode=true
Test 200 failed: net::ERR_CONNECTION_REFUSED at http://localhost:3000?testMode=true


=== Final Test Summary ===
Total tests completed: 94
Correct results: 86
Incorrect results: 8

=== Incorrect Results Details ===

Test #20:
  Expected: sovereign
  Actual: acolyte

Test #41:
  Expected: apex
  Actual: acolyte

Test #49:
  Expected: protector
  Actual: acolyte

Test #75:
  Expected: weaver
  Actual: acolyte

Test #76:
  Expected: beloved
  Actual: acolyte

Test #77:
  Expected: acolyte
  Actual: null

Test #87:
  Expected: phoenix
  Actual: acolyte

Test #88:
  Expected: apex
  Actual: acolyte
